Event_Date,USGS_Water_Level_ft,NOAA_Event_ID,NOAA_Description,Impact_Summary
2010-09-30,11.20,262825,Crabtree Creek flooding - crested at 12.69 feet,Minor flooding of Crabtree Creek
2011-08-06,12.17,339503,Flood waters infiltrated businesses and residences,8 people displaced, 45-50 people evacuated from Milner Hotel
2011-09-21,10.95,347398,Multiple roads blocked across Raleigh,$5000 damage, Blue Ridge Road, Hillsboro Street, Avent Ferry Road flooded
2013-09-01,12.54,477570,Crabtree Valley Mall parking deck flooded,$10000 damage, Multiple roads flooded, cars stranded
2014-08-12,12.37,541092,Multiple businesses evacuated from Capital Boulevard,$2500000 damage, 71 people rescued and evacuated
2016-07-17,15.24,653729,Heavy rain caused flooding along Crabtree Creek,0,Crabtree Creek remained over flood stage for 10+ hours
2017-04-25,16.57,696352,Lumley road closed due to flash flooding,$10000 damage, Between I-540 and Brier Creek Parkway
